{
  "profileVersion": 1,
  "expectedBackends": ["mercku_mtk7621"],
  "capabilities": {
    "sfp": false,
    "poeControl": false,
    "fanControl": false,
    "frozenConfig": false
  },
  "behavior": {
    "upgradeProbeStartDelayMs": 20000,
    "modeSwitchProbeStartDelayMs": 30000,
    "reconnectProbeTimeoutMs": 600000
  },
  "pageVariants": {}
}
